{
  "$defs": {
    "ScientificContext": {
      "additionalProperties": false,
      "properties": {
        "biological_system": {
          "maxLength": 200,
          "minLength": 1,
          "title": "Biological System",
          "type": "string"
        },
        "conditions": {
          "default": [],
          "items": {
            "type": "string"
          },
          "title": "Conditions",
          "type": "array"
        },
        "schema_version": {
          "const": "1.0.0",
          "default": "1.0.0",
          "title": "Schema Version",
          "type": "string"
        },
        "species": {
          "maxLength": 100,
          "minLength": 1,
          "title": "Species",
          "type": "string"
        }
      },
      "required": [
        "species",
        "biological_system"
      ],
      "title": "ScientificContext",
      "type": "object"
    }
  },
  "$id": "urn:peykar:schema:NativeModelSpec:1.0.0",
  "$schema": "https://json-schema.org/draft/2020-12/schema",
  "additionalProperties": false,
  "properties": {
    "context": {
      "$ref": "#/$defs/ScientificContext"
    },
    "format": {
      "enum": [
        "sbml",
        "pkml"
      ],
      "title": "Format",
      "type": "string"
    },
    "id": {
      "pattern": "^[a-z][a-z0-9_.-]{0,79}$",
      "title": "Id",
      "type": "string"
    },
    "license": {
      "maxLength": 500,
      "minLength": 1,
      "title": "License",
      "type": "string"
    },
    "limitations": {
      "items": {
        "type": "string"
      },
      "maxItems": 50,
      "minItems": 1,
      "title": "Limitations",
      "type": "array"
    },
    "schema_version": {
      "const": "1.0.0",
      "default": "1.0.0",
      "title": "Schema Version",
      "type": "string"
    },
    "source": {
      "maxLength": 2000,
      "minLength": 1,
      "title": "Source",
      "type": "string"
    },
    "title": {
      "maxLength": 500,
      "minLength": 1,
      "title": "Title",
      "type": "string"
    },
    "version": {
      "pattern": "^\\d+\\.\\d+\\.\\d+$",
      "title": "Version",
      "type": "string"
    }
  },
  "required": [
    "id",
    "version",
    "title",
    "format",
    "context",
    "license",
    "source",
    "limitations"
  ],
  "title": "NativeModelSpec",
  "type": "object"
}
