{
  "schema_version": "1.0.0",
  "id": "native.aciclovir",
  "version": "1.0.0",
  "title": "Original OSP Aciclovir PKML execution fixture",
  "format": "pkml",
  "context": {
    "schema_version": "1.0.0",
    "species": "Homo sapiens",
    "biological_system": "Original OSP Aciclovir PBPK model",
    "conditions": [
      "Original model schedule and parameter units retained"
    ]
  },
  "license": "GPL-2.0; original OSP model/source terms retained",
  "source": "Open-Systems-Pharmacology/OSPSuite-R commit 7482b90e043fcbb47048484b2c35ad250a849830, inst/extdata/Aciclovir.pkml",
  "limitations": [
    "Original-model solver execution; independent pharmacological validation is not established."
  ]
}
